{
  "name": "PersonName",
  "description": "Person name (currently - minimal sub-schema)",
  "id": "https://schema.org/Person",
  "version": "0.0.1",
  "author": "did:email:ruslan@shevchenko.kiev.ua",
  "trustRegistry": {
    "type": "permissionless"
  },
  "properties": {
    "givenName": { "type": "string" },
    "familyName": { "type": "string" }
  }
}
